,Text,Topic,Rating,Likes,Food,Broad Filter,Media,Age,Gender,food,supermarkets,related,drinks,slang,diet,meals,Dmeals,words_no,Polarity,restaurants,brands,Media_0,Media_1,Media_2,BMI,topic_no
57,"Ik ga naar een restaurant. Genaamt: Bonte koe. Als toetje kan je een wafel nemen met chocolade saus, slagroom, arbeien en poedersuiler. Mmmmmn?????????????????????????? ",9: Diverse / long,4.0,2.0,"['saus', 'wafel', 'restaurant', 'chocolad', 'slagrom', 'toetj']","['ga', 'restaurant', 'genaamt', 'bont', 'koe', 'toetj', 'wafel', 'nem', 'chocolad', 'saus', 'slagrom', 'arbei', 'poedersuiler', 'mmmn']",0.0,10.0,1.0,4.0,0.0,2.0,0.0,0.0,0.0,0.0,0.0,6.0,-0.6499999999999999,0.0,0.0,1.0,0.0,0.0,17.0,9
154,Ik niet heb net kapsalon bij noortjes zaak gegeten,9: Diverse / long,4.0,1.0,['kapsalon'],"['net', 'kapsalon', 'noortjes', 'zak', 'geget']",1.0,11.0,0.0,0.0,0.0,0.0,0.0,0.0,0.0,0.0,1.0,1.0,0.55,0.0,0.0,0.0,1.0,0.0,24.0,9
170,Luke als je een hond had was hij eerste dag al opgegeten dus hjb maar gwn,9: Diverse / long,,0.0,['opgeget'],"['luk', 'hond', 'eerst', 'dag', 'opgeget', 'hjb', 'gwn']",0.0,12.0,0.0,0.0,0.0,1.0,0.0,0.0,0.0,0.0,0.0,1.0,0.0,0.0,0.0,1.0,0.0,0.0,20.0,9
172,"Als hij een hond hij had, lag die al op de barbecue",9: Diverse / long,3.0,0.0,['barbecue'],"['hond', 'lag', 'barbecue']",0.0,12.0,0.0,0.0,0.0,0.0,0.0,0.0,0.0,1.0,0.0,1.0,0.0,0.0,0.0,1.0,0.0,0.0,20.0,9
313,Fietsen tafel is net een wafel met chocolade saus,9: Diverse / long,4.0,0.0,"['saus', 'wafel', 'chocolad', 'tafel']","['fiets', 'tafel', 'net', 'wafel', 'chocolad', 'saus']",0.0,10.0,0.0,3.0,0.0,1.0,0.0,0.0,0.0,0.0,0.0,4.0,0.55,0.0,0.0,1.0,0.0,0.0,19.0,9
314,Een fiets een tafel is met een wafel chocoladesaus,9: Diverse / long,4.0,0.0,"['wafel', 'chocoladesaus', 'tafel']","['fiet', 'tafel', 'wafel', 'chocoladesaus']",0.0,10.0,0.0,2.0,0.0,1.0,0.0,0.0,0.0,0.0,0.0,3.0,0.0,0.0,0.0,1.0,0.0,0.0,19.0,9
394,Rara waar ben ik? Hind:tafelen,9: Diverse / long,,0.0,['tafel'],"['rara', 'war', 'hind', 'tafel']",0.0,9.0,0.0,0.0,0.0,1.0,0.0,0.0,0.0,0.0,0.0,1.0,0.2,0.0,0.0,1.0,0.0,0.0,22.0,9
451,Ik hou deze telefoon gewoon op mijn tafel,9: Diverse / long,,0.0,['tafel'],"['hou', 'telefon', 'gewon', 'tafel']",0.0,10.0,1.0,0.0,0.0,1.0,0.0,0.0,0.0,0.0,0.0,1.0,0.0,0.0,0.0,1.0,0.0,0.0,15.0,9
516,Burger King foot lettuce,9: Diverse / long,2.0,0.0,['burger'],"['burger', 'king', 'fot', 'lettuc']",0.0,11.0,0.0,0.0,0.0,0.0,0.0,0.0,0.0,1.0,0.0,1.0,0.0,0.0,0.0,1.0,0.0,0.0,20.0,9
689,Ik moet de tafel dekken ben zo terug,9: Diverse / long,,0.0,['tafel'],"['tafel', 'dek', 'terug']",0.0,10.0,0.0,0.0,0.0,1.0,0.0,0.0,0.0,0.0,0.0,1.0,0.0,0.0,0.0,1.0,0.0,0.0,0.0,9
690,Ik moet even de tafel dekken,9: Diverse / long,,0.0,['tafel'],"['even', 'tafel', 'dek']",0.0,10.0,0.0,0.0,0.0,1.0,0.0,0.0,0.0,0.0,0.0,1.0,0.0,0.0,0.0,1.0,0.0,0.0,0.0,9
691,Ik moet eerst de tafel dekken,9: Diverse / long,,0.0,['tafel'],"['eerst', 'tafel', 'dek']",0.0,10.0,0.0,0.0,0.0,1.0,0.0,0.0,0.0,0.0,0.0,1.0,0.0,0.0,0.0,1.0,0.0,0.0,0.0,9
727,Wij biefstuk,9: Diverse / long,3.0,0.0,['biefstuk'],"['wij', 'biefstuk']",0.0,10.0,1.0,1.0,0.0,0.0,0.0,0.0,0.0,0.0,0.0,1.0,0.0,0.0,0.0,1.0,0.0,0.0,13.0,9
802,Tafelen bij de speelplaats van 678,9: Diverse / long,,0.0,['tafel'],"['tafel', 'speelplat', '678']",0.0,10.0,1.0,0.0,0.0,1.0,0.0,0.0,0.0,0.0,0.0,1.0,0.0,0.0,0.0,1.0,0.0,0.0,15.0,9
1192,Hey sorry moest even tafel dekken,9: Diverse / long,,0.0,['tafel'],"['hey', 'sorry', 'moest', 'even', 'tafel', 'dek']",0.0,10.0,1.0,0.0,0.0,1.0,0.0,0.0,0.0,0.0,0.0,1.0,0.0,0.0,0.0,1.0,0.0,0.0,18.0,9
1218,Nou omdat als een koe geen poten heeft dan is het een biefstuk omdat biefstuk van een koe gemaakt wordt dus ja,9: Diverse / long,3.0,0.0,"['biefstuk', 'biefstuk']","['nou', 'koe', 'pot', 'biefstuk', 'biefstuk', 'koe', 'gemaakt']",0.0,10.0,1.0,1.0,0.0,0.0,0.0,0.0,0.0,0.0,0.0,2.0,-0.6,0.0,0.0,1.0,0.0,0.0,18.0,9
1220,Omdat een koe als hij geslacht word geeft hij biefstuk en hij heeft geen poten dus hij stuk biefstuk,9: Diverse / long,3.0,3.0,"['biefstuk', 'biefstuk']","['koe', 'geslacht', 'word', 'geeft', 'biefstuk', 'pot', 'stuk', 'biefstuk']",0.0,10.0,0.0,1.0,0.0,0.0,0.0,0.0,0.0,0.0,0.0,2.0,0.0,0.0,0.0,1.0,0.0,0.0,17.0,9
1228,Hoezo biefstuk..Neh snap m niet..??,9: Diverse / long,3.0,0.0,['biefstuk'],"['hoezo', 'biefstuk', 'neh', 'snap']",0.0,10.0,1.0,1.0,0.0,0.0,0.0,0.0,0.0,0.0,0.0,1.0,0.0,0.0,0.0,1.0,0.0,0.0,16.0,9
1282,Spaghetti met saus,9: Diverse / long,3.0,0.0,"['saus', 'spaghetti']","['spaghetti', 'saus']",0.0,11.0,0.0,1.0,0.0,0.0,0.0,0.0,0.0,1.0,0.0,2.0,0.0,0.0,0.0,1.0,0.0,0.0,29.0,9
1503, verwijderen hond hond hond hond hond hond hond hond hallo hallo hallo hallo hallo hallo groente groenten groente groenten groente zo stom  ook met Juf Anneke Zwolle maar School is stom ook met Juf Anneke,9: Diverse / long,1.0,1.0,"['groent', 'groent', 'groent', 'groent', 'groent']","['verwijder', 'hond', 'hond', 'hond', 'hond', 'hond', 'hond', 'hond', 'hond', 'hallo', 'hallo', 'hallo', 'hallo', 'hallo', 'hallo', 'groent', 'groent', 'groent', 'groent', 'groent', 'stom', 'juf', 'annek', 'zwoll', 'schol', 'stom', 'juf', 'annek']",0.0,11.0,0.0,1.0,0.0,0.0,0.0,0.0,0.0,0.0,0.0,5.0,-0.4333333333333333,0.0,0.0,1.0,0.0,0.0,18.0,9
1511,Ik zij toch dat je geen wifi nodig hebt ik ben nu kapsalon aan het bestellen terwijlnik aan het vasten ben maar dat is voor later ,9: Diverse / long,4.0,1.0,['kapsalon'],"['wifi', 'nodig', 'hebt', 'kapsalon', 'bestell', 'terwijlnik', 'vast', 'later']",0.0,11.0,0.0,0.0,0.0,0.0,0.0,0.0,0.0,0.0,1.0,1.0,0.125,0.0,0.0,1.0,0.0,0.0,0.0,9
1614,Ik moest de tafel afruimen??,9: Diverse / long,,0.0,['tafel'],"['moest', 'tafel', 'afruim']",0.0,10.0,1.0,0.0,0.0,1.0,0.0,0.0,0.0,0.0,0.0,1.0,0.0,0.0,0.0,1.0,0.0,0.0,17.0,9
1634,Bah ik hou niet van donuts bah bah????,9: Diverse / long,4.0,0.0,['donut'],"['bah', 'hou', 'donut', 'bah', 'bah']",0.0,9.0,1.0,1.0,0.0,0.0,0.0,0.0,0.0,1.0,0.0,1.0,0.0,0.0,0.0,1.0,0.0,0.0,16.0,9
1729,Ik hou van saus alleen van saus Ik kan niet leven in een wereld zonder saus,9: Diverse / long,4.0,1.0,"['saus', 'saus', 'saus']","['hou', 'saus', 'allen', 'saus', 'lev', 'wereld', 'saus']",0.0,11.0,1.0,1.0,0.0,0.0,0.0,0.0,0.0,0.0,0.0,3.0,0.0,0.0,0.0,1.0,0.0,0.0,17.0,9
1866,Er lag gwn een briefje op tafel van: Hey Alicja! Ik ben even naar de winkel??????,9: Diverse / long,,0.0,['tafel'],"['lag', 'gwn', 'briefj', 'tafel', 'hey', 'alicja', 'even', 'winkel']",0.0,10.0,1.0,0.0,0.0,1.0,0.0,0.0,0.0,0.0,0.0,1.0,-0.6499999999999999,0.0,0.0,1.0,0.0,0.0,14.0,9
1870,Ik ga naae het dorp limonade haalen vergeeten te zegen tegen me moeder ??,9: Diverse / long,5.0,1.0,['limonad'],"['ga', 'naae', 'dorp', 'limonad', 'hal', 'verget', 'zeg', 'moeder']",0.0,10.0,1.0,0.0,0.0,0.0,1.0,0.0,0.0,0.0,0.0,1.0,0.0,0.0,0.0,1.0,0.0,0.0,18.0,9
1883,Magnum nodig we hebben naar me nodig we hebben namen nodig hebben namen hebben we nodig hebben we nodig hebben namen nodig we hebben namen nodig Boer en dan mannen Mr Mister,9: Diverse / long,5.0,0.0,['magnum'],"['magnum', 'nodig', 'we', 'nodig', 'we', 'nam', 'nodig', 'nam', 'we', 'nodig', 'we', 'nodig', 'nam', 'nodig', 'we', 'nam', 'nodig', 'boer', 'mann', 'mr', 'mister']",0.0,9.0,1.0,1.0,0.0,0.0,0.0,0.0,0.0,0.0,0.0,1.0,0.25,0.0,1.0,1.0,0.0,0.0,15.0,9
2055,Ga naar het schoolplein  en zoen de ping pong tafel,9: Diverse / long,,0.0,['tafel'],"['ga', 'schoolplein', 'zoen', 'ping', 'pong', 'tafel']",0.0,10.0,0.0,0.0,0.0,1.0,0.0,0.0,0.0,0.0,0.0,1.0,-0.6499999999999999,0.0,0.0,1.0,0.0,0.0,20.0,9
2144,Hey im wil je een zakje chips van mij ???,9: Diverse / long,4.0,0.0,['chip'],"['hey', 'im', 'zakj', 'chip']",0.0,10.0,1.0,1.0,0.0,0.0,0.0,0.0,0.0,0.0,0.0,1.0,0.0,0.0,0.0,1.0,0.0,0.0,16.0,9
